doc_id,Name,org,source_type,date,language,study_title,card_text,text_org_masked_path,full_text_path,topic_seed,stakeholder_type,label_source,near_dup_cluster
hesa441_childrens_health_0035,"Submission to the Standing Committee Health Study on Children’s Health June 9, 2022",Wilms Cancer Foundation,hesa_brief,2022-10-04,en,Children's Health,"Submission to the Standing Committee Health Study on Children’s Health June 9, 2022 How to Reduce Childhood Cancer Deaths and Health Care Costs through Fiscal Responsibility… The Need The [ORG] ([ORG]), is a charitable organization, that seeks to support and represent the needs of children, families and healthcare organizations affected by the childhood kidney cancer neprhoblastoma or as it is more commonly know; ‘Wilms’. Our mission is to establish a national program of awareness, education, advocacy, early detection and treatment to tackle the spread of this devastating disease. In addition, we look to support children, families and healthcare organizations directly in order to relieve the emotional and financial burden they face. Through various programs and initiatives the Foundation is a leading information resource and destination in support of those suffering or tackling the disease. The Disease: Wilms is the most common type of kidney cancer in children and the 4th most common childhood cancer overall. In fact, 9/10 childhood kidney cancers are Wilms. Overall around 7,500 children in under the age of 18 suffer from the disease in North America at any given moment and about 190,000 children worldwide. Wilms' tumor most often affects children ages 3-4 but can also affect children in their teens and sometimes adults. Often beginning in the womb, with the tumour growing on the kidney, the most common symptom is usually a sudden swollen stomach. Eventually the tumor becomes much bigger than the kidney itself and both usually require removal. Later stage Wilms can spread",data/interim/clean/hesa441_childrens_health_0035_masked.txt,data/interim/clean/hesa441_childrens_health_0035.txt,unlabeled,,weak,
hesa441_childrens_health_0036,MENTAL HEALTH STATUS OF BC YOUTH DURING COVID-19,"Doan, Quynh",hesa_brief,2022-10-04,en,Children's Health,"MENTAL HEALTH STATUS OF BC YOUTH DURING COVID-19 Background It was anticipated that children and adolescents would be significantly impacted by the COVID-19 pandemic. The volume of visits to a pediatric emergency department (ED) for a mental health concern has been consistently rising pre-pandemic (at approximately 8% per year since at least 2002)1, and this trend was maintained during the pandemic. Social isolation and psychological stress may significantly impact mental wellness, affecting youth who might not be presenting to the ED for care during the pandemic. Therefore, observing ED volume visits alone may be underestimating the psychosocial impact of the pandemic on our children and youth, as well as their resource needs. Study approach and results Our study estimated the psychosocial burden on children and youth in BC, using MyHEARTSMAP is a validated digital psychosocial self-assessment instrument that triggers customized health services recommendations based on the assessment data. MyHEARTSMAP covers 10 psychosocial areas: Home, Education and activities, Alcohol and drugs, Relationships and bullying, Thoughts and anxiety, Safety, Sexual health, Mood, Abuse, and Professional resources. These areas map to one of 4 domains: psychiatry, social, functional status, and youth health. 2–4 We further evaluated the association between demographic variables, as well as families’ pandemic experiences (schooling, employment, etc.) and access to recommended services informed by the self-assessment. This study included a diverse and representative sample of children and youth in BC (manuscript in peer review for publication). MyHEARTSMAP psychosocial self-assessment5,6 was completed by 424 children and/or their guardian between August 2020",data/interim/clean/hesa441_childrens_health_0036_masked.txt,data/interim/clean/hesa441_childrens_health_0036.txt,public_health,individual,weak,
hesa441_childrens_health_0038,"The Impact of COVID-19 on the Physical Activity and Sedentary Behaviours of Children in Canada Response to the House of Commons Standing Committee on Health Study on Children’s Health (September 7, 20",ParticipACTION,hesa_brief,2022-09-15,en,Children's Health,"The Impact of COVID-19 on the Physical Activity and Sedentary Behaviours of Children in Canada Response to the House of Commons Standing Committee on Health Study on Children’s Health (September 7, 2022) working from home.10 With easing restrictions, we may be able to re-establish the routines and schedules we had before the pandemic or create new ones. And with this switch, now is an ideal time to consider how and when children and youth can get moving to optimize their health. Less physical education, fewer organized sports, and isolation from friends Recent Canadian research provided evidence that stress due to social isolation was associated with deterioration in multiple mental health domains during COVID-19.11 In addition to high screen use and social isolation, the worsening of child mental health could be related to the displacement of sleep, physical exercise, and other prosocial activities, which were disrupted during the pandemic.12,13,14 Although policies aimed at controlling the spread of COVID-19 have varied across the country, youth in Canada were generally asked to limit contact with people outside of their household, which reduces opportunities for physical activity outside of the home. Additionally, many youths across Canada have been affected by school closures and by restrictions on physical education and organized sports. Not all playing fields are equal Even more concerning is the fact that equity‐deserving groups – e.g., women and girls, newcomers to Canada, persons with disabilities, members of the LGBTQ2S+ communities – report even lower rates of physical activity participation, placing these special",data/interim/clean/hesa441_childrens_health_0038_masked.txt,data/interim/clean/hesa441_childrens_health_0038.txt,public_health,,weak,
hesa441_childrens_health_0041,Policy Brief www.[ORG].ca • www.ccdus.ca August 2022 Policy Brief,Canadian Centre on Substance Use and Addiction,hesa_brief,2022-08-31,en,Children's Health,"Policy Brief www.[ORG].ca • www.ccdus.ca August 2022 Policy Brief Brief The [ORG] ([ORG]) welcomes the opportunity to provide a brief to the Standing Committee on Health’s focus on children’s health. [ORG] is the only national organization with a legislated mandate to reduce the harm of alcohol and other drugs on people in Canada. Created by an act of Parliament almost 35 years ago, [ORG] provides national leadership by harnessing the power of research and providing evidence-informed guidance to decision makers, curating knowledge and bringing together diverse perspectives to galvanize individual and collective efforts. Research from [ORG] has produced important information about children's health and substance use. For example, in a study on emergency department (ED) admissions, youth and young adults admitted to the ED due to substance use predominately reported the use of alcohol, followed by cannabis and opioids (King et al., in press). In addition to concerns about ED visits, early childhood experiences play a large role in the health and well-being of children and their future, including their relationships with substances. Adverse childhood experiences (ACEs) affect brain development. Understanding this can help prevent substance use issues and build resilient communities. Substance use health is directly tied to the social determinants of health, including a safe and healthy childhood. As such, substance use health is an important consideration within the children’s health sphere. Youth and Emergency Department Visits [ORG]’s study, An Evaluation of Psychoactive Substances that Bring Youth to the Emergency Department, sought to find out which psychoactive substances",data/interim/clean/hesa441_childrens_health_0041_masked.txt,data/interim/clean/hesa441_childrens_health_0041.txt,public_health,academic,weak,ndc_005
hesa441_childrens_health_0043,[ORG]’s Submission to The Standing Committee on Health’s Children’s Health Study,Manitoba Advocate for Children and Youth,hesa_brief,2022-08-18,en,Children's Health,"[ORG]’s Submission to The Standing Committee on Health’s Children’s Health Study August 11, 2022 Introduction The [ORG] ([ORG]) is an independent office of the Manitoba Legislative Assembly and is empowered by The Advocate for Children and Youth Act (ACYA) to advise children, youth, and young adults of their rights and the services which should be available to them. We do this by providing direct advocacy support to young people and their families, by reviewing public service delivery after the death of a child, and by conducting child-centred research regarding the effectiveness of public services in Manitoba. The Advocate also has the responsibility to raise issues with government on behalf of the province’s children, and to advise the government on issues and areas of concern. Accordingly, and pursuant to Standing Order 108(2), the following report is presented to the Standing Committee on Health to inform its children’s health study. Specifically, this report focuses on some of [ORG]’s recent child-centred research on youth suicide and infant mortality including in Manitoba’s rural, racialized, low income, and Indigenous communities, as well as how the pandemic has impacted children’s health and access to services in our province. Children’s Health is a Children’s Rights Issue The Governments of Canada and Manitoba have acknowledged that all children have rights and assumed responsibility for the protection and fulfillment of these rights by ratifying the United Nations Convention on the Rights of the Child (UNCRC). The UNCRC recognizes children and the support they need to help them experience happy,",data/interim/clean/hesa441_childrens_health_0043_masked.txt,data/interim/clean/hesa441_childrens_health_0043.txt,unlabeled,,weak,
hesa441_childrens_health_0044,"Submission to the House of Commons Committee on Health: Study on Children’s Health Submitted by [ORG]. June 11, 2022. [ORG] (“Action Canada”) is a registered Canadian charity that",Action Canada for Sexual Health and Rights,hesa_brief,2022-07-21,en,Children's Health,"Submission to the House of Commons Committee on Health: Study on Children’s Health Submitted by [ORG]. June 11, 2022. [ORG] (“Action Canada”) is a registered Canadian charity that works in Canada and around the world to promote health, well-being, and rights related to sexuality and reproduction. Building on the 50-year legacy of the organizations that formed Action Canada1 , we provide direct support, referrals, and information to the people who need it most, partner with groups and organizations on a range of campaigns using a collaborative, movement-building approach, and work with decision-makers to advance progressive policies on access to abortion, stigma-free healthcare, gender equality, 2SLGBTQ+ rights, and inclusive sex-ed. Our vision is for all people everywhere to have full control over, and to decide freely upon, all matters related to their sexuality, reproduction, and gender, including their reproductive and sexual health. Action Canada places human rights and dignity at the centre of its work and strives to consider and addresses the diverse needs and intersectional circumstances of different communities. It is through this lens that we are addressing the issue of sexual and reproductive health and rights as it pertains to children’s health. The Situation The ongoing pandemic has impacted access to sexual and reproductive health and rights for children and adolescents across Canada. There has been a weakening of existing sexual health provisions which has in turn caused an increase in STBBI rates and a decrease in access to a range of services and information for young people. Access",data/interim/clean/hesa441_childrens_health_0044_masked.txt,data/interim/clean/hesa441_childrens_health_0044.txt,womens_health,patient_advocacy,weak,
hesa441_childrens_health_0045,"June 30, 2022",Canadian Dental Hygienists Association,hesa_brief,2022-07-07,en,Children's Health,"June 30, 2022 Submission from the [ORG] ([ORG]) to the House of Commons Standing Committee on Health RE: Study on Children’s Health In Canada, registered dental hygienists are in a prime position, as essential oral health care providers, to prevent and treat oral conditions and diseases in children by providing individualized and accessible preventive and therapeutic oral care services and treatments. Good oral health is essential to overall health and well-being throughout the lifespan. There cannot be children’s health without oral health. Baby teeth generally appear between the ages of 4 months and 2½ years. These primary teeth are very important for the child’s health and overall development. They help children to chew food properly, develop healthy speech patterns, and they hold a place for the permanent teeth to follow. Tooth decay is the most common disease children experience. Cavities in baby teeth can lead to pain and infection and can negatively affect children’s growth and development. As conveyed in a 2013 report by the Canadian Institute for Health Information (CIHI) that examined the treatment of preventable dental cavities in preschoolers that progressed to such an extent that their dental care occurs as day surgery almost exclusively under general anesthesia: The development of cavities in the primary teeth of children due to early childhood caries represents a significant burden in both human and financial terms. The oral pain and infection associated with early childhood caries can result in lost sleep, poor growth, behavioural problems, and poor learning. Early childhood caries",data/interim/clean/hesa441_childrens_health_0045_masked.txt,data/interim/clean/hesa441_childrens_health_0045.txt,unlabeled,physician_org,weak,
hesa441_childrens_health_0047,Regulating Advertising of Foods and Beverages to Children Based on Quebec’s Experience Brief submitted to the Standing Committee on Health,Coalition québécoise sur la problématique du poids,hesa_brief,2022-06-21,en,Children's Health,"Regulating Advertising of Foods and Beverages to Children Based on Quebec’s Experience Brief submitted to the Standing Committee on Health June 9, 2022 [An initiative sponsored by the Association pour la santé publique du Québec] Adopting healthy lifestyle habits starting in childhood helps prevent many health problems In Canada, children and adolescents obtain more than half their calories from ultraprocessed foods.1 Yet these foods are often high in sugar, sodium or saturated fat and low in protein, fibre, vitamins and minerals. Eating these foods is associated with an increased risk of chronic diseases, including type 2 diabetes and high blood pressure, and even death.2 More than four in 10 Canadian adults have at least one chronic condition such as cancer, type 2 diabetes or cardiovascular disease.3 Children are also affected and are being diagnosed at an increasingly young age with hypertension or type 2 diabetes, to name just two examples.4, 5 While eating habits developed in childhood tend to continue into adulthood,6 many diseases could be avoided by implementing preventive measures that encourage healthy lifestyle habits starting in childhood. Advertising foods and beverages to children must be subject to legislation The agri-food industry’s marketing activities influence children’s food knowledge, attitudes toward foods, food preferences and eating habits.7, 8, 9, 10, 11 Children are vulnerable to advertising that targets them directly. Given their state of cognitive development, they cannot discern the commercial intentions behind the marketing and exercise critical judgment.12 Children start to understand the true nature of advertising only around",data/interim/clean/hesa441_childrens_health_0047_masked.txt,data/interim/clean/hesa441_childrens_health_0047.txt,unlabeled,,weak,
hesa441_childrens_health_0049,"Submission to the Standing Committee on Health Study on Children’s Health June 9, 2022",Stop Marketing to Kids Coalition,hesa_brief,2022-06-15,en,Children's Health,"Submission to the Standing Committee on Health Study on Children’s Health June 9, 2022 Introduction: The [ORG] is made up of 10 non-governmental organizations including Childhood Obesity Foundation, Heart & Stroke, Alberta Policy Coalition for Chronic Disease Prevention, BC Alliance for Healthy Living, Canadian Cancer Society, Canadian Dental Association, Chronic Disease Prevention Alliance of Canada, Diabetes Canada, Food Secure Canada and the Quebec Coalition on Weight-Related Problems. The [ORG] is endorsed by over 120 organizations and individuals, including notable health experts concerned about the burden of diet-related disease in Canada. Through cross-sector collaboration and evidence-informed policy development, the Stop Marketing to Kids Coalition encourages policies that adequately protect children from commercial marketing to kids of food and beverages that are high in sugar, salt and saturated fats in Canada. In particular, our coalition encourages the federal government to implement the remaining measures from Canada’s Healthy Eating Strategy, with a focus on restrictions on food and beverage marketing to children under the age of 13. It is an effective way to protect kids and support parents in making healthy food choices. Our food environment should make healthy food decision-making easy for families, and this is one of the effective tools that will help give kids the best start on the road to a long, healthy life. Scope of the problem: Kids are eating too much highly processed food Before the pandemic, ultra-processed food consumption was highest in children 9-13 years, making up nearly 60% of the calories they consumed.1 Within the",data/interim/clean/hesa441_childrens_health_0049_masked.txt,data/interim/clean/hesa441_childrens_health_0049.txt,unlabeled,,weak,
hesa441_childrens_health_0050,[ORG] Lesbian Gay Alliance Canada [ORG] [ORG],Canadian Gender Report / Gender Dysphoria Alliance Canada / Genspect / LGB Alliance - Canada Chapter / Vancouver Lesbian Collective,hesa_brief,2022-06-15,en,Children's Health,"[ORG] Lesbian Gay Alliance Canada [ORG] [ORG] [ORG] The Situation Over the last ten years there has been a massive increase in the numbers of children and youth seeking medical gender interventions. Gender clinics for youth around the world have reported tenfold or greater increases in the numbers of referrals. The patient population has also undergone a radical change from a majority of natal boys and now consists predominantly of adolescent natal girls. (1) During the same period, the previous treatment protocol of watchful waiting and psychological support has been replaced by an affirmative model which is centered on self-declared gender identity. This new model is being applied in a way that does not consider underlying mental health issues or the difficult transition of puberty that can bring with it many challenges including discovering one’s sexual preferences, dealing with body image issues, peer influence and seeking social in-group validation and social media binge behaviours. The result is that more people, especially young women, are finding that affirmative care has not helped their mental health but has left them with permanent physical changes, loss of function, pain and numbness and ongoing medical issues. Many adolescent females do not “identify” as boys, but rather as “non-binary” or some other gender. Nevertheless, they are seeking out support and guidance from healthcare practitioners who in turn, have started to see their role as supporting a child’s “gender journey” and responding to children in distress with Lupron and other medical interventions. The Ontario based London",data/interim/clean/hesa441_childrens_health_0050_masked.txt,data/interim/clean/hesa441_childrens_health_0050.txt,unlabeled,,weak,
hesa441_childrens_health_0051,"Response to the House of Commons Standing Committee on Health Study on Children’s Health June 1, 2022",Heart and Stroke Foundation of Canada,hesa_brief,2022-06-07,en,Children's Health,"Response to the House of Commons Standing Committee on Health Study on Children’s Health June 1, 2022 Preamble The pandemic imposed many hardships on families and children across Canada, catalyzing a societal rethinking of the way we live our lives. Canadian public policy leaders should use this opportunity to better children’s health and establish cost-effective policies that contribute to healthy minds and bodies. Children had most of their social and physical activities outside of the home suspended during the pandemic. Moreover, many families found themselves adopting non-nutritious eating habits that can be associated with increased chronic disease morbidity and mortality later in life.1 We call on the federal government to help families recover from pandemic-induced strains on healthy and nutritious lifestyles and help families make better-informed healthy food choices. Unhealthy diets in Canada In Canada, diet-related factors are leading risk factors for death. In 2019, 36,000 deaths were attributed to unhealthy diets.2 During the early pandemic stages, 35% of Canadians reported increasing their consumption of junk foods and sweets.3 Canadian diets are currently dominated by ultra-processed foods, high in salt, sugars and saturated fats.4 Children and youth (ages 2-18) specifically, get over half their calories from ultra-processed foods.5 This is problematic, as a high intake of these foods is significantly associated with the incidence of chronic diseases and conditions including, obesity, diabetes and high blood pressure, all risk factors for heart disease and stroke.4 Chronic diseases impacted by modifiable risk factors like diet cost our health system approximately $26 billion",data/interim/clean/hesa441_childrens_health_0051_masked.txt,data/interim/clean/hesa441_childrens_health_0051.txt,unlabeled,patient_advocacy,weak,
hesa441_childrens_health_0057,"Submission to the Standing Committee on Health Study on Children’s Health April 12, 2022",HealthCareCAN,hesa_brief,2022-04-22,en,Children's Health,"Submission to the Standing Committee on Health Study on Children’s Health April 12, 2022 OVERVIEW [ORG], the national voice of Canada’s research hospitals and healthcare organizations, welcomes the opportunity to submit this brief to the Standing Committee on Health as part of its study on Children’s Health. Over the past two years, many of our member healthcare organizations, including those providing care to children and youth, have increasingly sounded the alarm on the impact the pandemic is having on the physical, mental, emotional, developmental, and social wellbeing of young people. Children and youth have dealt with a vast, and often swift, amount of change in a relatively short period of time. This has taken a tremendous toll on many, and healthcare organizations have worked hard to respond to their needs. Health services for children and youth were significantly strained prior to the pandemic and have been further stressed by heightened demand over the past two years. Children and youth are a unique demographic with their own healthcare needs, and immediate action is needed to shore up the services they require. On this point, [ORG] fully endorses the brief submitted by Children’s Healthcare Canada, also a [ORG] member organization. As an association representing healthcare organizations and focused on the health system broadly, [ORG] advocates for several key system-level changes that would also substantially improve health services to children and youth. The remainder of this brief will outline these recommendations. RECOMMENDATIONS Health Workforce 1. Improve the immigration and credentialing/licensing process to better",data/interim/clean/hesa441_childrens_health_0057_masked.txt,data/interim/clean/hesa441_childrens_health_0057.txt,unlabeled,industry,weak,
